{
  "project": {
    "project_id": "SYNTHETIC-001",
    "name": "Synthetic Mixed-Use Development",
    "location": "Example City",
    "currency": "USD",
    "unit_system": "SI"
  },
  "execution": {
    "workflow_version": "0.1.0",
    "document_revision_cutoff": "RFP issue 01 plus addendum 01",
    "requested_language": "en"
  },
  "documents": [
    {
      "source_id": "DOC-001",
      "title": "Synthetic Request for Proposal",
      "document_number": "RFP-SYN-001",
      "revision": "01",
      "date": "2026-01-15",
      "location": "Complete document",
      "extraction_method": "native",
      "confidence": 1.0
    }
  ],
  "workflow_inputs": {
    "project_context": "Synthetic evaluation data only",
    "document_register": [],
    "rfp_documents": ["DOC-001"],
    "submission_context": {
      "deadline": "2026-03-01T12:00:00Z",
      "channel": "Synthetic portal"
    }
  },
  "upstream_outputs": [],
  "requested_formats": ["json", "markdown"]
}
